{"contract_version":"compact-code-index-v1","evaluation":{"batch_reselection_allowed":false,"run_receipt_must_bind_index_bundle":true,"selected_batch_map_path":"artifacts/index/selected_batch_map.json","selection_is_input_only":true},"experiment":{"experiment_id":"exp-v1-514885b1f9357adb0e1f4126","lock_stage":"evaluation_frozen","semantic_sha256":"514885b1f9357adb0e1f41262a013e0788d5c02048c1fbcee64bd44948bf5aed"},"extraction":{"basic_fact_node_types":{"array_accesses":["subscript_expression"],"assignments":["assignment_expression"],"calls":["call_expression"],"casts":["cast_expression"],"conditions":["conditional_expression","if_statement","switch_statement"],"field_accesses":["field_expression"],"gotos":["goto_statement"],"loops":["do_statement","for_range_loop","for_statement","while_statement"],"pointer_operations":["pointer_expression"],"returns":["return_statement"],"sizeof_expressions":["sizeof_expression"],"updates":["update_expression"]},"content_source":"git_cat_file_blob_by_manifest_oid","diagnostic_policy":"skip_nodes_with_error_or_missing_descendants","function_body_stored":false,"macro_replacement_stored":false,"non_utf8_policy":"no_ast_facts_preserve_byte_grounding","parameter_max_utf8_bytes":192,"preprocessor_policy":"raw_unexpanded_all_branches_with_depth","signature_max_utf8_bytes":512,"supported_symbols":["FUNCTION","GLOBAL_VARIABLE","TYPEDEF","STRUCT","UNION","ENUM","CLASS","NAMESPACE","MACRO"],"symbol_roles":["DEFINITION","DECLARATION"],"type_body_stored":false,"utf8_policy":"selected_phase2_grammar_clean_subtrees","worktree_source_allowed":false},"identity":{"bundle_domain":"ai-sast-code-index-v1","call_domain":"ai-sast-call-id-v1","include_domain":"ai-sast-include-id-v1","short_id_hex_length":24,"symbol_domain":"ai-sast-symbol-id-v1"},"input_binding":{"evaluation_selection":{"path":"artifacts/evaluation/selection.json","sha256":"79d60a8f10aeed2cbadf8f1859a042cd8342484af653d50874a7e5d879df3b49"},"experiment_lock":{"path":"experiment.lock.yaml","sha256":"5ad44b6d49310712ca0a1259057b24249921a87b1202cc8c19db8ff82e5b943d"},"phase2_batch_manifest":{"path":"artifacts/chunking/batch_manifest.jsonl","sha256":"981f8b92703a289eae43f949ccd6fe1e6177e4578fca2b7e90ff4c617eb70324"},"phase2_chunk_manifest":{"path":"artifacts/chunking/chunk_manifest.jsonl","sha256":"26fc94b2c8463431655e52a37e8b6d479b76269dc3be896b405df930f824f733"},"phase2_chunking_contract":{"path":"artifacts/chunking/chunking_contract.json","sha256":"7879c0fe7833d434962cd445419df4354429eec25b2b3345802f5b21bb023620"},"phase2_file_manifest":{"path":"artifacts/chunking/file_manifest.jsonl","sha256":"4228d9501ea167b58c89ff24ee95120a596aeab789ad13abfae2769f33b351c0"},"source_manifest":{"path":"artifacts/coverage/source_manifest.jsonl","sha256":"74295e23c5c3a7376d77075dab89b2a6da278c00df7cc32dc2df69e7d79f62c2"}},"resolution":{"basis":"syntactic_name_candidates_without_build_configuration","call_statuses":["UNIQUE_FILE_LOCAL_CANDIDATE","UNIQUE_REPOSITORY_CANDIDATE","AMBIGUOUS","UNRESOLVED_EXTERNAL","INDIRECT_OR_DYNAMIC","MEMBER_OR_QUALIFIED","MACRO_OR_FUNCTION_AMBIGUOUS"],"called_by_storage":"derived_inverse_view_only","include_statuses":["UNIQUE_PATH_CANDIDATE","AMBIGUOUS_PATH_CANDIDATES","UNRESOLVED_WITHOUT_BUILD_CONFIG"]},"runtime":{"grammars":{"c":{"abi_version":15,"node_kind_count":363,"node_kind_fingerprint_sha256":"3478d4b1fc8df00d3d13503a8797c6b14377020841308b18507d9ca20d54c674","semantic_version":[0,24,2]},"cpp":{"abi_version":14,"node_kind_count":543,"node_kind_fingerprint_sha256":"44011e68be8a779c1ad0d0ce4f28aa89b41b894d83608fa7d44420ba578a6825","semantic_version":null}},"tree_sitter_c_version":"0.24.2","tree_sitter_cpp_version":"0.23.4","tree_sitter_language_version":15,"tree_sitter_min_compatible_language_version":13,"tree_sitter_version":"0.26.0"},"schema_version":1,"serialization":{"absolute_path_in_artifact_forbidden":true,"format":"utf8_no_bom_lf_sorted_keys_compact_json_allow_nan_false","python_hash_forbidden":true,"record_order":"path_utf8_start_byte_kind_full_identity"},"target":{"commit_sha":"a54a0dbb2b8dcf9bafdddfc9a9374fb51d97e976","file_list_sha256":"fb00da1a82fcd1e02b436c4f58cbd8391094901da8450b9881063db3558e6057","in_scope_files":654,"scope_sha256":"2d7910c98cd57192f9c80436d18d39be247a8b8e6705b98f831ee747b1d1d50a"}}
